-- Tests for the columnstore table access method (delta-store stage)
--
-- At this commit the AM stores every row in the delta heap.  The
-- delta-to-columnar compaction path lands in a later commit, so the
-- tests here exercise CREATE / INSERT / COPY / SELECT / DELETE /
-- UPDATE / TRUNCATE without invoking VACUUM.
CREATE EXTENSION columnstore;
CREATE TABLE cs_basic (a int, b text) USING columnstore;
-- Columnstore-tuned autovacuum / fillfactor defaults are stamped on
-- the relation at create time.
SELECT relname, reloptions FROM pg_class WHERE relname = 'cs_basic';
 relname  |                                     reloptions                                      
----------+-------------------------------------------------------------------------------------
 cs_basic | {autovacuum_vacuum_insert_threshold=100000,autovacuum_vacuum_insert_scale_factor=0}
(1 row)

INSERT INTO cs_basic SELECT g, 'val' || g FROM generate_series(1, 50) g;
SELECT count(*) FROM cs_basic;
 count 
-------
    50
(1 row)

SELECT a, b FROM cs_basic WHERE a = 25;
 a  |   b   
----+-------
 25 | val25
(1 row)

SELECT a FROM cs_basic ORDER BY a LIMIT 5;
 a 
---
 1
 2
 3
 4
 5
(5 rows)

-- DELETE from the delta store
DELETE FROM cs_basic WHERE a <= 5;
SELECT count(*) FROM cs_basic;
 count 
-------
    45
(1 row)

-- UPDATE in the delta store (delete + insert under the hood)
UPDATE cs_basic SET b = 'updated' WHERE a = 10;
SELECT a, b FROM cs_basic WHERE a = 10;
 a  |    b    
----+---------
 10 | updated
(1 row)

-- Transaction visibility
BEGIN;
INSERT INTO cs_basic VALUES (1000, 'rolled');
SELECT count(*) FROM cs_basic;
 count 
-------
    46
(1 row)

ROLLBACK;
SELECT count(*) FROM cs_basic;
 count 
-------
    45
(1 row)

-- TRUNCATE
TRUNCATE cs_basic;
SELECT count(*) FROM cs_basic;
 count 
-------
     0
(1 row)

DROP TABLE cs_basic;
-- INSERT ... SELECT between columnstore tables and to/from heap
CREATE TABLE cs_src (a int, b text) USING columnstore;
INSERT INTO cs_src SELECT g, 'src' || g FROM generate_series(1, 20) g;
CREATE TABLE cs_dst (a int, b text) USING columnstore;
INSERT INTO cs_dst SELECT a, b FROM cs_src;
SELECT count(*) FROM cs_dst;
 count 
-------
    20
(1 row)

CREATE TABLE cs_heap_dst (a int, b text);
INSERT INTO cs_heap_dst SELECT a, b FROM cs_src;
SELECT count(*) FROM cs_heap_dst;
 count 
-------
    20
(1 row)

DROP TABLE cs_dst;
DROP TABLE cs_heap_dst;
DROP TABLE cs_src;
-- COPY into delta
CREATE TABLE cs_copy (a int, b text) USING columnstore;
COPY cs_copy FROM stdin;
SELECT count(*) FROM cs_copy ORDER BY 1;
 count 
-------
     3
(1 row)

SELECT * FROM cs_copy ORDER BY a;
 a |   b   
---+-------
 1 | one
 2 | two
 3 | three
(3 rows)

DROP TABLE cs_copy;
-- Delta-to-columnar freeze via VACUUM
CREATE TABLE cs_basic (a int, b text) USING columnstore;
INSERT INTO cs_basic SELECT i, 'row-' || i FROM generate_series(1, 20) i;
SELECT count(*) AS delta_count FROM cs_basic;
 delta_count 
-------------
          20
(1 row)

VACUUM cs_basic;
SELECT count(*) AS columnar_count FROM cs_basic;
 columnar_count 
----------------
             20
(1 row)

SELECT a, b FROM cs_basic WHERE a <= 5 ORDER BY a;
 a |   b   
---+-------
 1 | row-1
 2 | row-2
 3 | row-3
 4 | row-4
 5 | row-5
(5 rows)

SELECT a, b FROM cs_basic WHERE a = 20;
 a  |   b    
----+--------
 20 | row-20
(1 row)

-- Mixed delta + columnar scan
INSERT INTO cs_basic SELECT i, 'new-' || i FROM generate_series(100, 105) i;
SELECT count(*) AS mixed_count FROM cs_basic;
 mixed_count 
-------------
          26
(1 row)

SELECT a, b FROM cs_basic WHERE a >= 100 ORDER BY a;
  a  |    b    
-----+---------
 100 | new-100
 101 | new-101
 102 | new-102
 103 | new-103
 104 | new-104
 105 | new-105
(6 rows)

-- Multiple row groups
DROP TABLE cs_basic;
CREATE TABLE cs_basic (a int, b text) USING columnstore;
INSERT INTO cs_basic SELECT i, 'batch1-' || i FROM generate_series(1, 100) i;
VACUUM cs_basic;
INSERT INTO cs_basic SELECT i, 'batch2-' || i FROM generate_series(200, 250) i;
VACUUM cs_basic;
SELECT count(*) AS multi_rg_count FROM cs_basic;
 multi_rg_count 
----------------
            151
(1 row)

SELECT a, b FROM cs_basic WHERE a = 1;
 a |    b     
---+----------
 1 | batch1-1
(1 row)

SELECT a, b FROM cs_basic WHERE a = 200;
  a  |     b      
-----+------------
 200 | batch2-200
(1 row)

-- Zone map filtering (row group 1: a=1..100, row group 2: a=200..250)
-- All btree strategies: <, <=, =, >=, >
SELECT count(*) AS zm_lt FROM cs_basic WHERE a < 50;
 zm_lt 
-------
    49
(1 row)

SELECT count(*) AS zm_le FROM cs_basic WHERE a <= 100;
 zm_le 
-------
   100
(1 row)

SELECT count(*) AS zm_eq FROM cs_basic WHERE a = 200;
 zm_eq 
-------
     1
(1 row)

SELECT count(*) AS zm_ge FROM cs_basic WHERE a >= 200;
 zm_ge 
-------
    51
(1 row)

SELECT count(*) AS zm_gt FROM cs_basic WHERE a > 250;
 zm_gt 
-------
     0
(1 row)

-- Combined filter
SELECT count(*) AS zm_range FROM cs_basic WHERE a >= 50 AND a <= 100;
 zm_range 
----------
       51
(1 row)

SELECT count(*) AS zone_all FROM cs_basic;
 zone_all 
----------
      151
(1 row)

-- Zone maps with different by-value types
CREATE TABLE cs_zm_types (
    i int, f float4, d date, b bool
) USING columnstore;
INSERT INTO cs_zm_types
    SELECT i, i::float4, '2020-01-01'::date + i, (i % 2 = 0)
    FROM generate_series(1, 100) i;
VACUUM cs_zm_types;
INSERT INTO cs_zm_types
    SELECT i, i::float4, '2020-01-01'::date + i, (i % 2 = 0)
    FROM generate_series(200, 300) i;
VACUUM cs_zm_types;
-- These should benefit from zone map pruning
SELECT count(*) AS zm_int FROM cs_zm_types WHERE i > 150;
 zm_int 
--------
    101
(1 row)

SELECT count(*) AS zm_float FROM cs_zm_types WHERE f < 50.0::float4;
 zm_float 
----------
       49
(1 row)

SELECT count(*) AS zm_date FROM cs_zm_types WHERE d > '2020-07-20'::date;
 zm_date 
---------
      99
(1 row)

-- NULLs in zone maps
CREATE TABLE cs_zm_nulls (a int, b int) USING columnstore;
INSERT INTO cs_zm_nulls SELECT i, CASE WHEN i <= 50 THEN NULL ELSE i END
    FROM generate_series(1, 100) i;
VACUUM cs_zm_nulls;
-- b has NULLs but zone map should still track non-NULL range (51..100)
SELECT count(*) AS zm_null_eq FROM cs_zm_nulls WHERE b = 75;
 zm_null_eq 
------------
          1
(1 row)

SELECT count(*) AS zm_null_gt FROM cs_zm_nulls WHERE b > 100;
 zm_null_gt 
------------
          0
(1 row)

DROP TABLE cs_zm_types;
DROP TABLE cs_zm_nulls;
-- Zone maps on by-reference types (text, numeric)
CREATE TABLE cs_zm_text (id int, name text, amount numeric) USING columnstore;
INSERT INTO cs_zm_text SELECT i, 'aaa-' || i, i * 1.5
    FROM generate_series(1, 100) i;
VACUUM cs_zm_text;
INSERT INTO cs_zm_text SELECT i, 'zzz-' || i, i * 1.5
    FROM generate_series(101, 200) i;
VACUUM cs_zm_text;
-- Text zone map: should skip RG2
SELECT count(*) AS zm_text_eq FROM cs_zm_text WHERE name = 'aaa-50';
 zm_text_eq 
------------
          1
(1 row)

-- Text zone map: should skip RG1
SELECT count(*) AS zm_text_gt FROM cs_zm_text WHERE name > 'yyy';
 zm_text_gt 
------------
        100
(1 row)

-- Numeric zone map: should skip RG2
SELECT count(*) AS zm_num_lt FROM cs_zm_text WHERE amount < 10;
 zm_num_lt 
-----------
         6
(1 row)

-- Numeric zone map: should skip RG1
SELECT count(*) AS zm_num_gt FROM cs_zm_text WHERE amount > 200;
 zm_num_gt 
-----------
        67
(1 row)

DROP TABLE cs_zm_text;
-- Compression: highly-compressible data round-trips correctly
DROP TABLE cs_basic;
CREATE TABLE cs_basic (a int, b text) USING columnstore;
INSERT INTO cs_basic SELECT i, repeat('hello world ', 10) FROM generate_series(1, 1000) i;
VACUUM cs_basic;
SELECT count(*) AS compressed_count FROM cs_basic;
 compressed_count 
------------------
             1000
(1 row)

SELECT a, length(b) AS blen FROM cs_basic WHERE a = 500;
  a  | blen 
-----+------
 500 |  120
(1 row)

SELECT left(b, 11) AS b_prefix FROM cs_basic WHERE a = 42;
  b_prefix   
-------------
 hello world
(1 row)

DROP TABLE cs_basic;
-- Zero-column tables: a zero-attribute data tuple must not be mistaken
-- for a tombstone (tombstones are zero-attribute tuples distinguished by
-- their columnar-space t_ctid)
CREATE TABLE cs_zerocol () USING columnstore;
INSERT INTO cs_zerocol DEFAULT VALUES;
INSERT INTO cs_zerocol SELECT FROM generate_series(1, 50);
SELECT count(*) FROM cs_zerocol;
 count 
-------
    51
(1 row)

DELETE FROM cs_zerocol;
SELECT count(*) FROM cs_zerocol;
 count 
-------
     0
(1 row)

DROP TABLE cs_zerocol;
-- Partitioned parents may carry the columnstore AM: the autovacuum
-- defaults event trigger must skip them (no storage parameters on 'p'
-- relations), and partitions inherit the AM
CREATE TABLE cs_part (k int, v int) PARTITION BY RANGE (k) USING columnstore;
CREATE TABLE cs_part1 PARTITION OF cs_part FOR VALUES FROM (0) TO (100);
CREATE TABLE cs_part2 PARTITION OF cs_part FOR VALUES FROM (100) TO (200);
SELECT c.relname, a.amname,
       c.reloptions IS NOT NULL AS has_av_defaults
    FROM pg_class c LEFT JOIN pg_am a ON a.oid = c.relam
    WHERE c.relname IN ('cs_part', 'cs_part1', 'cs_part2')
    ORDER BY c.relname;
 relname  |   amname    | has_av_defaults 
----------+-------------+-----------------
 cs_part  | columnstore | f
 cs_part1 | columnstore | t
 cs_part2 | columnstore | t
(3 rows)

INSERT INTO cs_part SELECT g % 200, g FROM generate_series(1, 400) g;
SELECT count(*), sum(v) FROM cs_part;
 count |  sum  
-------+-------
   400 | 80200
(1 row)

SELECT count(*) FROM cs_part WHERE k < 100;
 count 
-------
   200
(1 row)

DELETE FROM cs_part WHERE v <= 200;
SELECT count(*), sum(v) FROM cs_part;
 count |  sum  
-------+-------
   200 | 60100
(1 row)

DROP TABLE cs_part;
-- The defaults are applied at creation, including CREATE TABLE AS /
-- SELECT INTO.  A table converted with ALTER TABLE ... SET ACCESS METHOD
-- columnstore does NOT get them (the trigger fires only on creation, so
-- that a later ALTER TABLE ... RESET of these options is not re-imposed).
CREATE TABLE cs_avd_ctas USING columnstore AS SELECT 1 AS v;
CREATE TABLE cs_avd_heap (v int);
ALTER TABLE cs_avd_heap SET ACCESS METHOD columnstore;
SELECT relname, reloptions IS NOT NULL AS has_av_defaults
    FROM pg_class
    WHERE relname IN ('cs_avd_ctas', 'cs_avd_heap')
    ORDER BY relname;
   relname   | has_av_defaults 
-------------+-----------------
 cs_avd_ctas | t
 cs_avd_heap | f
(2 rows)

DROP TABLE cs_avd_ctas, cs_avd_heap;
-- The autovacuum defaults are a creation-time convenience, not a lock-in:
-- a user can override them, and RESET must fall back to the GUC default
-- rather than being silently re-imposed by the event trigger.
CREATE TABLE cs_avd_reset (v int) USING columnstore;
SELECT reloptions FROM pg_class WHERE relname = 'cs_avd_reset';
                                     reloptions                                      
-------------------------------------------------------------------------------------
 {autovacuum_vacuum_insert_threshold=100000,autovacuum_vacuum_insert_scale_factor=0}
(1 row)

ALTER TABLE cs_avd_reset SET (autovacuum_vacuum_insert_threshold = 5000);
SELECT reloptions FROM pg_class WHERE relname = 'cs_avd_reset';
                                    reloptions                                     
-----------------------------------------------------------------------------------
 {autovacuum_vacuum_insert_scale_factor=0,autovacuum_vacuum_insert_threshold=5000}
(1 row)

ALTER TABLE cs_avd_reset RESET (autovacuum_vacuum_insert_threshold);
-- an unrelated ALTER afterwards must not bring the default back
ALTER TABLE cs_avd_reset ADD COLUMN w int;
SELECT reloptions FROM pg_class WHERE relname = 'cs_avd_reset';
                reloptions                 
-------------------------------------------
 {autovacuum_vacuum_insert_scale_factor=0}
(1 row)

DROP TABLE cs_avd_reset;
-- An option the user supplies at CREATE time is kept; the trigger only
-- fills in the one that is missing (here it must not overwrite the
-- explicit threshold, but must still add the scale_factor default).
CREATE TABLE cs_avd_explicit (v int) USING columnstore
    WITH (autovacuum_vacuum_insert_threshold = 5000);
SELECT unnest(reloptions) AS opt FROM pg_class
    WHERE relname = 'cs_avd_explicit' ORDER BY opt;
                   opt                   
-----------------------------------------
 autovacuum_vacuum_insert_scale_factor=0
 autovacuum_vacuum_insert_threshold=5000
(2 rows)

DROP TABLE cs_avd_explicit;
