--
-- Columnstore row group compaction tests (delta-to-columnar only)
--
-- Columnar DELETE and index builds land in later commits, so this stage
-- only exercises the parts of compaction that drive delta-store rows into
-- columnar row groups.
--
-- ===================================================================
-- Basic compaction: VACUUM moves delta rows into columnar storage
-- ===================================================================
CREATE TABLE cs_compact (id int, val text, num numeric(10,2)) USING columnstore;
INSERT INTO cs_compact SELECT i, 'row_' || i, (i * 1.5)::numeric(10,2)
    FROM generate_series(1, 500) i;
VACUUM cs_compact;
SELECT count(*) AS after_compact FROM cs_compact;
 after_compact 
---------------
           500
(1 row)

SELECT min(id), max(id) FROM cs_compact;
 min | max 
-----+-----
   1 | 500
(1 row)

SELECT id, val, num FROM cs_compact WHERE id = 401;
 id  |   val   |  num   
-----+---------+--------
 401 | row_401 | 601.50
(1 row)

SELECT id, val, num FROM cs_compact WHERE id = 500;
 id  |   val   |  num   
-----+---------+--------
 500 | row_500 | 750.00
(1 row)

DROP TABLE cs_compact;
-- ===================================================================
-- Compaction with multiple row groups
-- ===================================================================
CREATE TABLE cs_compact_multi (id int, val text) USING columnstore;
-- Create 3 row groups via successive insert + vacuum
INSERT INTO cs_compact_multi SELECT i, 'rg1_' || i FROM generate_series(1, 300) i;
VACUUM cs_compact_multi;
INSERT INTO cs_compact_multi SELECT i, 'rg2_' || i FROM generate_series(301, 600) i;
VACUUM cs_compact_multi;
INSERT INTO cs_compact_multi SELECT i, 'rg3_' || i FROM generate_series(601, 900) i;
VACUUM cs_compact_multi;
SELECT count(*) AS multi_rg_count FROM cs_compact_multi;
 multi_rg_count 
----------------
            900
(1 row)

SELECT count(*) FROM cs_compact_multi WHERE id BETWEEN 1 AND 300;
 count 
-------
   300
(1 row)

SELECT count(*) FROM cs_compact_multi WHERE id BETWEEN 301 AND 600;
 count 
-------
   300
(1 row)

SELECT count(*) FROM cs_compact_multi WHERE id BETWEEN 601 AND 900;
 count 
-------
   300
(1 row)

DROP TABLE cs_compact_multi;
-- ===================================================================
-- Compaction preserves data types correctly
-- ===================================================================
CREATE TABLE cs_compact_types (
    id int,
    i2 smallint,
    i8 bigint,
    t text,
    n numeric(10,2),
    d date,
    b bool
) USING columnstore;
INSERT INTO cs_compact_types SELECT
    i, (i % 100)::smallint, i::bigint * 1000000,
    'text_' || i, (i * 0.5)::numeric(10,2),
    '2020-01-01'::date + i, (i % 2 = 0)
    FROM generate_series(1, 500) i;
-- Save expected results
CREATE TABLE cs_compact_expected AS
    SELECT * FROM cs_compact_types;
VACUUM cs_compact_types;
-- Verify all types survived compaction
SELECT count(*) FROM (
    SELECT * FROM cs_compact_types
    EXCEPT
    SELECT * FROM cs_compact_expected
) diff;
 count 
-------
     0
(1 row)

DROP TABLE cs_compact_types;
DROP TABLE cs_compact_expected;
-- ===================================================================
-- Delta page reclamation: freed delta pages go onto the free list
-- so the relation doesn't grow indefinitely with insert/vacuum cycles
-- ===================================================================
CREATE TABLE cs_delta_reclaim (id int, val text) USING columnstore;
-- Cycle 1: insert and compact
INSERT INTO cs_delta_reclaim SELECT i, 'cycle1_' || i FROM generate_series(1, 500) i;
VACUUM cs_delta_reclaim;
SELECT pg_relation_size('cs_delta_reclaim') AS size_after_cycle1
    \gset
-- Cycle 2: insert more rows and compact again
INSERT INTO cs_delta_reclaim SELECT i, 'cycle2_' || i FROM generate_series(501, 1000) i;
VACUUM cs_delta_reclaim;
SELECT pg_relation_size('cs_delta_reclaim') AS size_after_cycle2
    \gset
-- Cycle 3: insert more rows and compact again
INSERT INTO cs_delta_reclaim SELECT i, 'cycle3_' || i FROM generate_series(1001, 1500) i;
VACUUM cs_delta_reclaim;
-- Relation size after cycle 3 should not be much larger than after cycle 2,
-- since the old delta pages should be reclaimed by the free list.
-- Without reclamation each cycle adds ~8 delta pages that are never freed.
SELECT pg_relation_size('cs_delta_reclaim') <=
       :'size_after_cycle2'::bigint * 2 AS delta_pages_reclaimed;
 delta_pages_reclaimed 
-----------------------
 t
(1 row)

-- Data integrity: all 1500 rows should survive
SELECT count(*) AS total_rows FROM cs_delta_reclaim;
 total_rows 
------------
       1500
(1 row)

DROP TABLE cs_delta_reclaim;
-- ===================================================================
-- VACUUM updates pg_class.reltuples and relallvisible
-- ===================================================================
CREATE TABLE cs_relstats (id int, val text) USING columnstore;
INSERT INTO cs_relstats SELECT i, 'row_' || i FROM generate_series(1, 500) i;
-- Before VACUUM, reltuples may be 0 or stale
VACUUM cs_relstats;
-- After VACUUM (which compacts delta to columnar), reltuples should
-- reflect the actual row count
SELECT reltuples > 0 AS has_reltuples FROM pg_class
    WHERE oid = 'cs_relstats'::regclass;
 has_reltuples 
---------------
 t
(1 row)

-- relallvisible should be 0 (columnstore does not track page visibility)
SELECT relallvisible = 0 AS allvis_zero FROM pg_class
    WHERE oid = 'cs_relstats'::regclass;
 allvis_zero 
-------------
 t
(1 row)

DROP TABLE cs_relstats;
-- ===================================================================
-- VACUUM reports stats to pg_stat_user_tables
-- ===================================================================
CREATE TABLE cs_vacstats (id int, val text) USING columnstore;
INSERT INTO cs_vacstats SELECT i, 'row_' || i FROM generate_series(1, 500) i;
VACUUM cs_vacstats;
-- last_vacuum should be set and n_live_tup should reflect row count
SELECT last_vacuum IS NOT NULL AS has_last_vacuum,
       n_live_tup > 0 AS has_live_tup
    FROM pg_stat_user_tables WHERE relname = 'cs_vacstats';
 has_last_vacuum | has_live_tup 
-----------------+--------------
 t               | t
(1 row)

DROP TABLE cs_vacstats;
-- ===================================================================
-- Freezing and relfrozenxid
-- ===================================================================
CREATE PROCEDURE cs_burn_xids(n int) LANGUAGE plpgsql AS $$
BEGIN
    FOR i IN 1..n LOOP
        PERFORM txid_current();
        COMMIT;
    END LOOP;
END $$;
-- relfrozenxid must advance across VACUUM (finding: pinned-at-creation
-- relfrozenxid eventually stalls the whole cluster at the wraparound
-- limit).  Burn xids so the pin would show as a large age, then check
-- that VACUUM's freeze pass plus an honest report brings the age back
-- close to the current xid.
CREATE TABLE cs_frozen (id int, val text) USING columnstore;
INSERT INTO cs_frozen SELECT i, 'f' || i FROM generate_series(1, 100) i;
CALL cs_burn_xids(5000);
SELECT age(relfrozenxid) > 4000 AS needs_freezing
  FROM pg_class WHERE relname = 'cs_frozen';
 needs_freezing 
----------------
 t
(1 row)

VACUUM cs_frozen;
SELECT age(relfrozenxid) < 1000 AS frozen_advanced
  FROM pg_class WHERE relname = 'cs_frozen';
 frozen_advanced 
-----------------
 t
(1 row)

-- rows survive freezing, in both storage forms
SELECT count(*), min(id), max(id) FROM cs_frozen;
 count | min | max 
-------+-----+-----
   100 |   1 | 100
(1 row)

INSERT INTO cs_frozen SELECT i, 'g' || i FROM generate_series(101, 150) i;
CALL cs_burn_xids(5000);
VACUUM cs_frozen;
SELECT age(relfrozenxid) < 1000 AS frozen_advanced_again
  FROM pg_class WHERE relname = 'cs_frozen';
 frozen_advanced_again 
-----------------------
 t
(1 row)

SELECT count(*), min(id), max(id) FROM cs_frozen;
 count | min | max 
-------+-----+-----
   150 |   1 | 150
(1 row)

DROP TABLE cs_frozen;
DROP PROCEDURE cs_burn_xids(int);
-- compaction over delta pages too full to take even a minimal tuple:
-- ~2KB rows leave page remainders below the fence-worthiness threshold,
-- so the consumable prefix is processed without fencing those pages
CREATE TABLE cs_full_pages (id int, pad text) USING columnstore;
ALTER TABLE cs_full_pages ALTER COLUMN pad SET STORAGE PLAIN;
INSERT INTO cs_full_pages
    SELECT g, rpad(md5(g::text), 1996, 'x') FROM generate_series(1, 400) g;
VACUUM cs_full_pages;
SELECT count(*), min(id), max(id), max(length(pad)) FROM cs_full_pages;
 count | min | max | max  
-------+-----+-----+------
   400 |   1 | 400 | 1996
(1 row)

-- the table keeps working for inserts and re-compaction afterwards
INSERT INTO cs_full_pages
    SELECT g, rpad(md5(g::text), 1996, 'x') FROM generate_series(401, 500) g;
VACUUM cs_full_pages;
SELECT count(*), max(id) FROM cs_full_pages;
 count | max 
-------+-----
   500 | 500
(1 row)

DROP TABLE cs_full_pages;
-- Dropped columns: compaction must skip attisdropped attributes (their
-- atttypid is 0, so any type/opclass lookup would fail) and keep
-- compacting; subsequent DDL still works
CREATE TABLE cs_dropcol (a int, b text, c numeric(8,2)) USING columnstore;
INSERT INTO cs_dropcol SELECT g, 't' || g, g * 1.5 FROM generate_series(1, 500) g;
ALTER TABLE cs_dropcol DROP COLUMN b;
VACUUM cs_dropcol;
SELECT count(*), sum(a), sum(c) FROM cs_dropcol;
 count |  sum   |    sum    
-------+--------+-----------
   500 | 125250 | 187875.00
(1 row)

INSERT INTO cs_dropcol SELECT g, g * 2.5 FROM generate_series(501, 600) g;
VACUUM cs_dropcol;
ALTER TABLE cs_dropcol DROP COLUMN c;
VACUUM cs_dropcol;
SELECT count(*), sum(a) FROM cs_dropcol;
 count |  sum   
-------+--------
   600 | 180300
(1 row)

ALTER TABLE cs_dropcol ADD COLUMN d int DEFAULT 7;
SELECT count(*) FILTER (WHERE d = 7) AS defaults FROM cs_dropcol;
 defaults 
----------
      600
(1 row)

DROP TABLE cs_dropcol;
-- Zero-column rows through compaction
CREATE TABLE cs_zerocol_vac () USING columnstore;
INSERT INTO cs_zerocol_vac SELECT FROM generate_series(1, 200);
VACUUM cs_zerocol_vac;
SELECT count(*) FROM cs_zerocol_vac;
 count 
-------
   200
(1 row)

DELETE FROM cs_zerocol_vac;
ERROR:  columnstore: columnar DELETE not yet supported
VACUUM cs_zerocol_vac;
SELECT count(*) FROM cs_zerocol_vac;
 count 
-------
   200
(1 row)

DROP TABLE cs_zerocol_vac;
-- Subtransaction xids in delta tuples: released and rolled-back
-- savepoints (inserts and deletes) must classify correctly through
-- compaction
CREATE TABLE cs_subxact (v int) USING columnstore;
INSERT INTO cs_subxact SELECT g FROM generate_series(1, 500) g;
VACUUM cs_subxact;
BEGIN;
SAVEPOINT s1;
DELETE FROM cs_subxact WHERE v <= 100;
ERROR:  columnstore: columnar DELETE not yet supported
RELEASE s1;
ERROR:  current transaction is aborted, commands ignored until end of transaction block
SAVEPOINT s2;
ERROR:  current transaction is aborted, commands ignored until end of transaction block
DELETE FROM cs_subxact WHERE v > 400;
ERROR:  current transaction is aborted, commands ignored until end of transaction block
ROLLBACK TO s2;
ERROR:  savepoint "s2" does not exist
INSERT INTO cs_subxact VALUES (1001);
ERROR:  current transaction is aborted, commands ignored until end of transaction block
SAVEPOINT s3;
ERROR:  current transaction is aborted, commands ignored until end of transaction block
INSERT INTO cs_subxact VALUES (1002);
ERROR:  current transaction is aborted, commands ignored until end of transaction block
ROLLBACK TO s3;
ERROR:  savepoint "s3" does not exist
COMMIT;
SELECT count(*), min(v), max(v) FROM cs_subxact;
 count | min | max 
-------+-----+-----
   500 |   1 | 500
(1 row)

VACUUM cs_subxact;
SELECT count(*), min(v), max(v) FROM cs_subxact;
 count | min | max 
-------+-----+-----
   500 |   1 | 500
(1 row)

DROP TABLE cs_subxact;
-- A row group whose rows are all deleted, then compaction again, then
-- reuse of the table
CREATE TABLE cs_alldel (v int) USING columnstore;
INSERT INTO cs_alldel SELECT g FROM generate_series(1, 1000) g;
VACUUM cs_alldel;
DELETE FROM cs_alldel;
ERROR:  columnstore: columnar DELETE not yet supported
SELECT count(*) FROM cs_alldel;
 count 
-------
  1000
(1 row)

VACUUM cs_alldel;
SELECT count(*) FROM cs_alldel;
 count 
-------
  1000
(1 row)

INSERT INTO cs_alldel VALUES (42);
VACUUM cs_alldel;
SELECT * FROM cs_alldel;
  v   
------
    1
    2
    3
    4
    5
    6
    7
    8
    9
   10
   11
   12
   13
   14
   15
   16
   17
   18
   19
   20
   21
   22
   23
   24
   25
   26
   27
   28
   29
   30
   31
   32
   33
   34
   35
   36
   37
   38
   39
   40
   41
   42
   43
   44
   45
   46
   47
   48
   49
   50
   51
   52
   53
   54
   55
   56
   57
   58
   59
   60
   61
   62
   63
   64
   65
   66
   67
   68
   69
   70
   71
   72
   73
   74
   75
   76
   77
   78
   79
   80
   81
   82
   83
   84
   85
   86
   87
   88
   89
   90
   91
   92
   93
   94
   95
   96
   97
   98
   99
  100
  101
  102
  103
  104
  105
  106
  107
  108
  109
  110
  111
  112
  113
  114
  115
  116
  117
  118
  119
  120
  121
  122
  123
  124
  125
  126
  127
  128
  129
  130
  131
  132
  133
  134
  135
  136
  137
  138
  139
  140
  141
  142
  143
  144
  145
  146
  147
  148
  149
  150
  151
  152
  153
  154
  155
  156
  157
  158
  159
  160
  161
  162
  163
  164
  165
  166
  167
  168
  169
  170
  171
  172
  173
  174
  175
  176
  177
  178
  179
  180
  181
  182
  183
  184
  185
  186
  187
  188
  189
  190
  191
  192
  193
  194
  195
  196
  197
  198
  199
  200
  201
  202
  203
  204
  205
  206
  207
  208
  209
  210
  211
  212
  213
  214
  215
  216
  217
  218
  219
  220
  221
  222
  223
  224
  225
  226
  227
  228
  229
  230
  231
  232
  233
  234
  235
  236
  237
  238
  239
  240
  241
  242
  243
  244
  245
  246
  247
  248
  249
  250
  251
  252
  253
  254
  255
  256
  257
  258
  259
  260
  261
  262
  263
  264
  265
  266
  267
  268
  269
  270
  271
  272
  273
  274
  275
  276
  277
  278
  279
  280
  281
  282
  283
  284
  285
  286
  287
  288
  289
  290
  291
  292
  293
  294
  295
  296
  297
  298
  299
  300
  301
  302
  303
  304
  305
  306
  307
  308
  309
  310
  311
  312
  313
  314
  315
  316
  317
  318
  319
  320
  321
  322
  323
  324
  325
  326
  327
  328
  329
  330
  331
  332
  333
  334
  335
  336
  337
  338
  339
  340
  341
  342
  343
  344
  345
  346
  347
  348
  349
  350
  351
  352
  353
  354
  355
  356
  357
  358
  359
  360
  361
  362
  363
  364
  365
  366
  367
  368
  369
  370
  371
  372
  373
  374
  375
  376
  377
  378
  379
  380
  381
  382
  383
  384
  385
  386
  387
  388
  389
  390
  391
  392
  393
  394
  395
  396
  397
  398
  399
  400
  401
  402
  403
  404
  405
  406
  407
  408
  409
  410
  411
  412
  413
  414
  415
  416
  417
  418
  419
  420
  421
  422
  423
  424
  425
  426
  427
  428
  429
  430
  431
  432
  433
  434
  435
  436
  437
  438
  439
  440
  441
  442
  443
  444
  445
  446
  447
  448
  449
  450
  451
  452
  453
  454
  455
  456
  457
  458
  459
  460
  461
  462
  463
  464
  465
  466
  467
  468
  469
  470
  471
  472
  473
  474
  475
  476
  477
  478
  479
  480
  481
  482
  483
  484
  485
  486
  487
  488
  489
  490
  491
  492
  493
  494
  495
  496
  497
  498
  499
  500
  501
  502
  503
  504
  505
  506
  507
  508
  509
  510
  511
  512
  513
  514
  515
  516
  517
  518
  519
  520
  521
  522
  523
  524
  525
  526
  527
  528
  529
  530
  531
  532
  533
  534
  535
  536
  537
  538
  539
  540
  541
  542
  543
  544
  545
  546
  547
  548
  549
  550
  551
  552
  553
  554
  555
  556
  557
  558
  559
  560
  561
  562
  563
  564
  565
  566
  567
  568
  569
  570
  571
  572
  573
  574
  575
  576
  577
  578
  579
  580
  581
  582
  583
  584
  585
  586
  587
  588
  589
  590
  591
  592
  593
  594
  595
  596
  597
  598
  599
  600
  601
  602
  603
  604
  605
  606
  607
  608
  609
  610
  611
  612
  613
  614
  615
  616
  617
  618
  619
  620
  621
  622
  623
  624
  625
  626
  627
  628
  629
  630
  631
  632
  633
  634
  635
  636
  637
  638
  639
  640
  641
  642
  643
  644
  645
  646
  647
  648
  649
  650
  651
  652
  653
  654
  655
  656
  657
  658
  659
  660
  661
  662
  663
  664
  665
  666
  667
  668
  669
  670
  671
  672
  673
  674
  675
  676
  677
  678
  679
  680
  681
  682
  683
  684
  685
  686
  687
  688
  689
  690
  691
  692
  693
  694
  695
  696
  697
  698
  699
  700
  701
  702
  703
  704
  705
  706
  707
  708
  709
  710
  711
  712
  713
  714
  715
  716
  717
  718
  719
  720
  721
  722
  723
  724
  725
  726
  727
  728
  729
  730
  731
  732
  733
  734
  735
  736
  737
  738
  739
  740
  741
  742
  743
  744
  745
  746
  747
  748
  749
  750
  751
  752
  753
  754
  755
  756
  757
  758
  759
  760
  761
  762
  763
  764
  765
  766
  767
  768
  769
  770
  771
  772
  773
  774
  775
  776
  777
  778
  779
  780
  781
  782
  783
  784
  785
  786
  787
  788
  789
  790
  791
  792
  793
  794
  795
  796
  797
  798
  799
  800
  801
  802
  803
  804
  805
  806
  807
  808
  809
  810
  811
  812
  813
  814
  815
  816
  817
  818
  819
  820
  821
  822
  823
  824
  825
  826
  827
  828
  829
  830
  831
  832
  833
  834
  835
  836
  837
  838
  839
  840
  841
  842
  843
  844
  845
  846
  847
  848
  849
  850
  851
  852
  853
  854
  855
  856
  857
  858
  859
  860
  861
  862
  863
  864
  865
  866
  867
  868
  869
  870
  871
  872
  873
  874
  875
  876
  877
  878
  879
  880
  881
  882
  883
  884
  885
  886
  887
  888
  889
  890
  891
  892
  893
  894
  895
  896
  897
  898
  899
  900
  901
  902
  903
  904
  905
  906
  907
  908
  909
  910
  911
  912
  913
  914
  915
  916
  917
  918
  919
  920
  921
  922
  923
  924
  925
  926
  927
  928
  929
  930
  931
  932
  933
  934
  935
  936
  937
  938
  939
  940
  941
  942
  943
  944
  945
  946
  947
  948
  949
  950
  951
  952
  953
  954
  955
  956
  957
  958
  959
  960
  961
  962
  963
  964
  965
  966
  967
  968
  969
  970
  971
  972
  973
  974
  975
  976
  977
  978
  979
  980
  981
  982
  983
  984
  985
  986
  987
  988
  989
  990
  991
  992
  993
  994
  995
  996
  997
  998
  999
 1000
   42
(1001 rows)

DROP TABLE cs_alldel;
